{
  "schema_version": 1,
  "pipeline_version": "v6",
  "date": "2025-11-11",
  "generated_at": "2025-11-11T03:02:24.519Z",
  "run_id": "qualify-publish-2025-11-11-20251111030224.-00656c3f",
  "sources": {
    "github": {
      "published": 54,
      "qualified": 54,
      "passonce": 0,
      "coverage_pct": 1,
      "duplicates": 0,
      "inputs": {
        "passonce": 0,
        "qualified": 54
      }
    },
    "huggingface": {
      "published": 112,
      "qualified": 78,
      "passonce": 34,
      "coverage_pct": 0.6964,
      "duplicates": 0,
      "inputs": {
        "passonce": 34,
        "qualified": 78
      }
    }
  },
  "totals": {
    "items": 166,
    "coverage_pct": 0.7952,
    "sources": [
      "github",
      "huggingface"
    ]
  },
  "classification": {
    "tasks": {
      "taxonomy_total": 91,
      "buckets_covered": 29,
      "coverage_pct": 0.3187,
      "assignments": 194,
      "items_with_assignments": 111,
      "items_without_assignments": 55
    },
    "categories": {
      "taxonomy_total": 9,
      "buckets_covered": 8,
      "coverage_pct": 0.8889,
      "assignments": 125,
      "items_with_assignments": 53,
      "items_without_assignments": 1
    }
  },
  "checksums": {
    "data/ai/modelswatch/daily/2025-11-11.github.json": "sha256:0e4f97e5c5587a520554a5ff5cc5316d5adf3ee8ccc17390fb073bfd433e18e8",
    "data/ai/modelswatch/daily_github.json": "sha256:0e4f97e5c5587a520554a5ff5cc5316d5adf3ee8ccc17390fb073bfd433e18e8",
    "data/ai/modelswatch/daily/2025-11-11.huggingface.json": "sha256:36d16b6bd9df5afb9739baaae0d5fe6ac667cecb1e57b4886eeefc6b33882fe1",
    "data/ai/modelswatch/daily_hf.json": "sha256:36d16b6bd9df5afb9739baaae0d5fe6ac667cecb1e57b4886eeefc6b33882fe1",
    "data/ai/modelswatch/index/models_by_task.json": "sha256:ec91ff7faf2123c746bde01d1bc3554e6b072776d50113cbdc7de15cd095ad16",
    "data/ai/modelswatch/index/projects_by_category.json": "sha256:0db80876dc3af11bd8841ee770a0dc120b34245f543e009fa14d884007958c6d",
    "data/ai/modelswatch/fetch_priorities.json": "sha256:52b151bae993c60201bace2d69190077f0bb712ceee2afb63a3b7b8febc2fd48",
    "data/ai/modelswatch/models_hotlist.json": "sha256:f79f9b2af01cf6c11d08cd1805e7dddf65730494d556e44d184cc4622071532c",
    "data/ai/modelswatch/projects_hotlist.json": "sha256:ed53e0c5b957be03efa6e28876b785cc002a95cd403217367d0e12960b735c12",
    "data/ai/modelswatch/daily/2025-11-11.legacy.json": "sha256:6d09cf318946b7419db59dcb54d4a48a4653a74c5cac9c8c06116a667550ea67",
    "data/ai/modelswatch/daily_legacy.json": "sha256:6d09cf318946b7419db59dcb54d4a48a4653a74c5cac9c8c06116a667550ea67",
    "data/ai/modelswatch/daily/dates.json": "sha256:84bd04f00959dc8418875e30549dfa1064e131d06f74bfb0040bce5729411a0d"
  },
  "artifacts": {
    "daily": [
      "data/ai/modelswatch/daily/2025-11-11.github.json",
      "data/ai/modelswatch/daily/2025-11-11.huggingface.json"
    ],
    "daily_aliases": [
      "data/ai/modelswatch/daily_github.json",
      "data/ai/modelswatch/daily_hf.json"
    ],
    "indexes": [
      "data/ai/modelswatch/index/models_by_task.json",
      "data/ai/modelswatch/index/projects_by_category.json"
    ],
    "hotlists": [
      "data/ai/modelswatch/models_hotlist.json",
      "data/ai/modelswatch/projects_hotlist.json"
    ],
    "legacy": [
      "data/ai/modelswatch/daily/2025-11-11.legacy.json"
    ],
    "legacy_aliases": [
      "data/ai/modelswatch/daily_legacy.json"
    ],
    "dates": [
      "data/ai/modelswatch/daily/dates.json"
    ],
    "state": [],
    "audit": [],
    "planning": [
      "data/ai/modelswatch/fetch_priorities.json"
    ]
  },
  "notes": {
    "legacy_items": 166,
    "hotlists": {
      "models": {
        "categories": 29,
        "items": 194
      },
      "projects": {
        "categories": 8,
        "items": 125
      }
    }
  }
}
