{
  "schema_version": 1,
  "pipeline_version": "v6",
  "date": "2025-11-02",
  "generated_at": "2025-11-02T03:02:36.340Z",
  "run_id": "qualify-publish-2025-11-02-20251102030236.-67084e32",
  "sources": {
    "github": {
      "published": 0,
      "qualified": 0,
      "passonce": 0,
      "coverage_pct": 0,
      "duplicates": 0,
      "inputs": {
        "passonce": 0,
        "qualified": 0
      }
    },
    "huggingface": {
      "published": 1,
      "qualified": 1,
      "passonce": 0,
      "coverage_pct": 1,
      "duplicates": 0,
      "inputs": {
        "passonce": 0,
        "qualified": 1
      }
    }
  },
  "totals": {
    "items": 1,
    "coverage_pct": 1,
    "sources": [
      "github",
      "huggingface"
    ]
  },
  "classification": {
    "tasks": {
      "taxonomy_total": 91,
      "buckets_covered": 2,
      "coverage_pct": 0.022,
      "assignments": 2,
      "items_with_assignments": 1,
      "items_without_assignments": 0
    },
    "categories": {
      "taxonomy_total": 9,
      "buckets_covered": 0,
      "coverage_pct": 0,
      "assignments": 0,
      "items_with_assignments": 0,
      "items_without_assignments": 0
    }
  },
  "checksums": {
    "data/ai/modelswatch/daily/2025-11-02.github.json": "sha256:4f5ed3c92aea0561b1115be2bed368f7a6237afdd0c2bf00e5dd26ad90df09e7",
    "data/ai/modelswatch/daily_github.json": "sha256:4f5ed3c92aea0561b1115be2bed368f7a6237afdd0c2bf00e5dd26ad90df09e7",
    "data/ai/modelswatch/daily/2025-11-02.huggingface.json": "sha256:8cb7476394d2a2141de896a8c1532f697d4c8c38cf2028c369da9fe3345efca7",
    "data/ai/modelswatch/daily_hf.json": "sha256:8cb7476394d2a2141de896a8c1532f697d4c8c38cf2028c369da9fe3345efca7",
    "data/ai/modelswatch/index/models_by_task.json": "sha256:e5f97d0dd5c0392999bdaf6af543f1fbef73157d46796f3a884ac2f210ae4111",
    "data/ai/modelswatch/fetch_priorities.json": "sha256:3d9d1d65177c998345b8fd02992c278ade086d4e3926941e51818db0ad02d450",
    "data/ai/modelswatch/models_hotlist.json": "sha256:e8e67bb672e5434a5d7db3745e5e40ae4872d0695bf468828161147dd000b776",
    "data/ai/modelswatch/projects_hotlist.json": "sha256:b97f98c4440fd19141a62ee4b315c86243d7634c797525c5bc17287ddd5ad913",
    "data/ai/modelswatch/daily/2025-11-02.legacy.json": "sha256:4f4e133016695aaa760b29270587df8943731583daff4ce9b498248a61819f22",
    "data/ai/modelswatch/daily_legacy.json": "sha256:4f4e133016695aaa760b29270587df8943731583daff4ce9b498248a61819f22",
    "data/ai/modelswatch/daily/dates.json": "sha256:9e7a5b1ad63bcf5ffb06b2296ba9fd0be77a073a671508df4f7b263dc0412a4f"
  },
  "artifacts": {
    "daily": [
      "data/ai/modelswatch/daily/2025-11-02.github.json",
      "data/ai/modelswatch/daily/2025-11-02.huggingface.json"
    ],
    "daily_aliases": [
      "data/ai/modelswatch/daily_github.json",
      "data/ai/modelswatch/daily_hf.json"
    ],
    "indexes": [
      "data/ai/modelswatch/index/models_by_task.json"
    ],
    "hotlists": [
      "data/ai/modelswatch/models_hotlist.json",
      "data/ai/modelswatch/projects_hotlist.json"
    ],
    "legacy": [
      "data/ai/modelswatch/daily/2025-11-02.legacy.json"
    ],
    "legacy_aliases": [
      "data/ai/modelswatch/daily_legacy.json"
    ],
    "dates": [
      "data/ai/modelswatch/daily/dates.json"
    ],
    "state": [],
    "audit": [],
    "planning": [
      "data/ai/modelswatch/fetch_priorities.json"
    ]
  },
  "notes": {
    "legacy_items": 1,
    "hotlists": {
      "models": {
        "categories": 2,
        "items": 2
      },
      "projects": {
        "categories": 0,
        "items": 0
      }
    }
  }
}
