{
  "schema_version": 1,
  "pipeline_version": "v6",
  "date": "2026-04-07",
  "generated_at": "2026-04-07T03:48:25.771Z",
  "run_id": "qualify-publish-2026-04-07-20260407034825.-e564f58c",
  "sources": {
    "github": {
      "published": 4,
      "qualified": 4,
      "passonce": 0,
      "coverage_pct": 1,
      "duplicates": 0,
      "inputs": {
        "passonce": 0,
        "qualified": 7
      }
    },
    "huggingface": {
      "published": 0,
      "qualified": 0,
      "passonce": 0,
      "coverage_pct": 0,
      "duplicates": 0,
      "inputs": {
        "passonce": 5,
        "qualified": 0
      }
    }
  },
  "totals": {
    "items": 12,
    "coverage_pct": 1,
    "sources": [
      "github",
      "huggingface"
    ]
  },
  "classification": {
    "tasks": {
      "taxonomy_total": 91,
      "buckets_covered": 8,
      "coverage_pct": 0.0879,
      "assignments": 10,
      "items_with_assignments": 5,
      "items_without_assignments": 7
    },
    "categories": {
      "taxonomy_total": 9,
      "buckets_covered": 8,
      "coverage_pct": 0.8889,
      "assignments": 20,
      "items_with_assignments": 7,
      "items_without_assignments": 0
    }
  },
  "checksums": {
    "data/ai/modelswatch/daily/2026-04-07.github.json": "sha256:8e72c6a049d29911aece866417dfe739dd8008ca5c383510128ec40910528441",
    "data/ai/modelswatch/daily_github.json": "sha256:8e72c6a049d29911aece866417dfe739dd8008ca5c383510128ec40910528441",
    "data/ai/modelswatch/daily/2026-04-07.huggingface.json": "sha256:eec69d2034df57a1c510cffbc73390f620b85c0e652c2dd5744bcf093bbce9bb",
    "data/ai/modelswatch/daily_hf.json": "sha256:eec69d2034df57a1c510cffbc73390f620b85c0e652c2dd5744bcf093bbce9bb",
    "data/ai/modelswatch/index/models_by_task.json": "sha256:8084000d9b2646d4035463269670199142bd32b965d1b5f440442ebfecfa1cdd",
    "data/ai/modelswatch/index/projects_by_category.json": "sha256:e1ed131df007ca789740824745180198919fdc3f76186d17649af5ea1045bdf7",
    "data/ai/modelswatch/fetch_priorities.json": "sha256:e35df60a95168c6d3919d137041f176e2959f017bfdf3c7c6707b0e78b1ad98a",
    "data/ai/modelswatch/models_hotlist.json": "sha256:79df80aee9728fcc31343afa31100440a7e740111a8b3b159e88cd4d67eed66e",
    "data/ai/modelswatch/projects_hotlist.json": "sha256:cd6e91be63a86604e831dfefe1951a98430eaf9ee4c8f413b7f401a44a7f882f",
    "data/ai/modelswatch/daily/2026-04-07.legacy.json": "sha256:e50246c0f9980ec3b15d58004f03d2b037b7ba9f48c894afe8856f3ffbc6daa3",
    "data/ai/modelswatch/daily_legacy.json": "sha256:e50246c0f9980ec3b15d58004f03d2b037b7ba9f48c894afe8856f3ffbc6daa3",
    "data/ai/modelswatch/daily/dates.json": "sha256:35c90689af23b163eff1ac9f5a50bd253c00606d43c9fad46b1a6d5e915ba0e2"
  },
  "artifacts": {
    "daily": [
      "data/ai/modelswatch/daily/2026-04-07.github.json",
      "data/ai/modelswatch/daily/2026-04-07.huggingface.json"
    ],
    "daily_aliases": [
      "data/ai/modelswatch/daily_github.json",
      "data/ai/modelswatch/daily_hf.json"
    ],
    "indexes": [
      "data/ai/modelswatch/index/models_by_task.json",
      "data/ai/modelswatch/index/projects_by_category.json"
    ],
    "hotlists": [
      "data/ai/modelswatch/models_hotlist.json",
      "data/ai/modelswatch/projects_hotlist.json"
    ],
    "legacy": [
      "data/ai/modelswatch/daily/2026-04-07.legacy.json"
    ],
    "legacy_aliases": [
      "data/ai/modelswatch/daily_legacy.json"
    ],
    "dates": [
      "data/ai/modelswatch/daily/dates.json"
    ],
    "state": [],
    "audit": [],
    "planning": [
      "data/ai/modelswatch/fetch_priorities.json"
    ]
  },
  "notes": {
    "legacy_items": 12,
    "hotlists": {
      "models": {
        "categories": 6,
        "items": 8
      },
      "projects": {
        "categories": 8,
        "items": 20
      }
    }
  }
}
