{
  "schema_version": 1,
  "pipeline_version": "v6",
  "date": "2026-01-19",
  "generated_at": "2026-01-19T03:21:15.612Z",
  "run_id": "qualify-publish-2026-01-19-20260119032115.-6734b9b4",
  "sources": {
    "github": {
      "published": 4,
      "qualified": 4,
      "passonce": 0,
      "coverage_pct": 1,
      "duplicates": 0,
      "inputs": {
        "passonce": 0,
        "qualified": 6
      }
    },
    "huggingface": {
      "published": 0,
      "qualified": 0,
      "passonce": 0,
      "coverage_pct": 0,
      "duplicates": 0,
      "inputs": {
        "passonce": 5,
        "qualified": 0
      }
    }
  },
  "totals": {
    "items": 11,
    "coverage_pct": 1,
    "sources": [
      "github",
      "huggingface"
    ]
  },
  "classification": {
    "tasks": {
      "taxonomy_total": 91,
      "buckets_covered": 7,
      "coverage_pct": 0.0769,
      "assignments": 10,
      "items_with_assignments": 6,
      "items_without_assignments": 5
    },
    "categories": {
      "taxonomy_total": 9,
      "buckets_covered": 6,
      "coverage_pct": 0.6667,
      "assignments": 13,
      "items_with_assignments": 6,
      "items_without_assignments": 0
    }
  },
  "checksums": {
    "data/ai/modelswatch/daily/2026-01-19.github.json": "sha256:8c92330d80f35d863fa4e49654651545305178f8616b0532257a6bb3c1bd0f06",
    "data/ai/modelswatch/daily_github.json": "sha256:8c92330d80f35d863fa4e49654651545305178f8616b0532257a6bb3c1bd0f06",
    "data/ai/modelswatch/daily/2026-01-19.huggingface.json": "sha256:186834da4e533ce155de6ef743f1b60b5e3160913fce8d584c004002000385af",
    "data/ai/modelswatch/daily_hf.json": "sha256:186834da4e533ce155de6ef743f1b60b5e3160913fce8d584c004002000385af",
    "data/ai/modelswatch/index/models_by_task.json": "sha256:795eaaf5bf45a83a18185326cc23c3f0709226bc57b702a2fc9fd94520748672",
    "data/ai/modelswatch/index/projects_by_category.json": "sha256:e2edfeb3596138efd89296701800b4bd4ef0ba5a172df9d21917a39ff104dc77",
    "data/ai/modelswatch/fetch_priorities.json": "sha256:d1e25faa9bd67608869e8fc72a9ad7233792ab280f97f7843dcb69399b71b072",
    "data/ai/modelswatch/models_hotlist.json": "sha256:f7a16d07b71279fdb5e36fd15f3d34780bbf70ef9971a62493a463c5f900557d",
    "data/ai/modelswatch/projects_hotlist.json": "sha256:2ebc64f3a4640a504260deffbbebfd0a688f49b8dd583dd117314077ed8fe1dd",
    "data/ai/modelswatch/daily/2026-01-19.legacy.json": "sha256:7fa7934c30723b385df115d20f5fe9f7134ca1ca7ae24aba775b11c514af449c",
    "data/ai/modelswatch/daily_legacy.json": "sha256:7fa7934c30723b385df115d20f5fe9f7134ca1ca7ae24aba775b11c514af449c",
    "data/ai/modelswatch/daily/dates.json": "sha256:85f29453fef140e4569dbe6a31b5664d2f2490afdbb6cb8254d5e57031a9f2bc"
  },
  "artifacts": {
    "daily": [
      "data/ai/modelswatch/daily/2026-01-19.github.json",
      "data/ai/modelswatch/daily/2026-01-19.huggingface.json"
    ],
    "daily_aliases": [
      "data/ai/modelswatch/daily_github.json",
      "data/ai/modelswatch/daily_hf.json"
    ],
    "indexes": [
      "data/ai/modelswatch/index/models_by_task.json",
      "data/ai/modelswatch/index/projects_by_category.json"
    ],
    "hotlists": [
      "data/ai/modelswatch/models_hotlist.json",
      "data/ai/modelswatch/projects_hotlist.json"
    ],
    "legacy": [
      "data/ai/modelswatch/daily/2026-01-19.legacy.json"
    ],
    "legacy_aliases": [
      "data/ai/modelswatch/daily_legacy.json"
    ],
    "dates": [
      "data/ai/modelswatch/daily/dates.json"
    ],
    "state": [],
    "audit": [],
    "planning": [
      "data/ai/modelswatch/fetch_priorities.json"
    ]
  },
  "notes": {
    "legacy_items": 11,
    "hotlists": {
      "models": {
        "categories": 5,
        "items": 6
      },
      "projects": {
        "categories": 6,
        "items": 13
      }
    }
  }
}
