{
  "schema_version": 1,
  "pipeline_version": "v6",
  "date": "2025-12-10",
  "generated_at": "2025-12-10T03:14:04.883Z",
  "run_id": "qualify-publish-2025-12-10-20251210031404.-4ab22dc0",
  "sources": {
    "github": {
      "published": 0,
      "qualified": 0,
      "passonce": 0,
      "coverage_pct": 0,
      "duplicates": 0,
      "inputs": {
        "passonce": 0,
        "qualified": 1
      }
    },
    "huggingface": {
      "published": 1,
      "qualified": 1,
      "passonce": 0,
      "coverage_pct": 1,
      "duplicates": 0,
      "inputs": {
        "passonce": 5,
        "qualified": 1
      }
    }
  },
  "totals": {
    "items": 7,
    "coverage_pct": 1,
    "sources": [
      "github",
      "huggingface"
    ]
  },
  "classification": {
    "tasks": {
      "taxonomy_total": 91,
      "buckets_covered": 8,
      "coverage_pct": 0.0879,
      "assignments": 9,
      "items_with_assignments": 4,
      "items_without_assignments": 3
    },
    "categories": {
      "taxonomy_total": 9,
      "buckets_covered": 3,
      "coverage_pct": 0.3333,
      "assignments": 3,
      "items_with_assignments": 1,
      "items_without_assignments": 0
    }
  },
  "checksums": {
    "data/ai/modelswatch/daily/2025-12-10.github.json": "sha256:ad97c37bc3afcbe55cad92370f8ba109db04628c70f387cc4bf034becf7b1a30",
    "data/ai/modelswatch/daily_github.json": "sha256:ad97c37bc3afcbe55cad92370f8ba109db04628c70f387cc4bf034becf7b1a30",
    "data/ai/modelswatch/daily/2025-12-10.huggingface.json": "sha256:1853ab4fd4770abdf697fe459c51276dc79317f284c8ebf16d2ff3e09b574c47",
    "data/ai/modelswatch/daily_hf.json": "sha256:1853ab4fd4770abdf697fe459c51276dc79317f284c8ebf16d2ff3e09b574c47",
    "data/ai/modelswatch/index/models_by_task.json": "sha256:026f7066e5efa99995314b084f8f0d988b973f70e1e1388cdb9e621aca36c985",
    "data/ai/modelswatch/index/projects_by_category.json": "sha256:3ce22429e585d418009185b4658258499029d4d65464de0aaa48f446c0d31452",
    "data/ai/modelswatch/fetch_priorities.json": "sha256:c7b80f1df52beee96e79b15b4a3ff861dbc22d65214ca2068a90ed4deee7855d",
    "data/ai/modelswatch/models_hotlist.json": "sha256:da7aa130eb6fe9cc901dc076e9b42d6b92bdc996070df2dcfa891fe3d8f18f74",
    "data/ai/modelswatch/projects_hotlist.json": "sha256:5e319fe528a20bf0c5eea5c4ea409ce22f99d758ca0128ac7ee843207e63d1ef",
    "data/ai/modelswatch/daily/2025-12-10.legacy.json": "sha256:bec4be68cf0ba1fd015ad4e2d01af9644f0b10ab49d0baa6cda6bb695ea7609e",
    "data/ai/modelswatch/daily_legacy.json": "sha256:bec4be68cf0ba1fd015ad4e2d01af9644f0b10ab49d0baa6cda6bb695ea7609e",
    "data/ai/modelswatch/daily/dates.json": "sha256:53ecd4329c67fb2f1e51c85f90f695d52252279a3c23a61fa93e8c68a1b39bad"
  },
  "artifacts": {
    "daily": [
      "data/ai/modelswatch/daily/2025-12-10.github.json",
      "data/ai/modelswatch/daily/2025-12-10.huggingface.json"
    ],
    "daily_aliases": [
      "data/ai/modelswatch/daily_github.json",
      "data/ai/modelswatch/daily_hf.json"
    ],
    "indexes": [
      "data/ai/modelswatch/index/models_by_task.json",
      "data/ai/modelswatch/index/projects_by_category.json"
    ],
    "hotlists": [
      "data/ai/modelswatch/models_hotlist.json",
      "data/ai/modelswatch/projects_hotlist.json"
    ],
    "legacy": [
      "data/ai/modelswatch/daily/2025-12-10.legacy.json"
    ],
    "legacy_aliases": [
      "data/ai/modelswatch/daily_legacy.json"
    ],
    "dates": [
      "data/ai/modelswatch/daily/dates.json"
    ],
    "state": [],
    "audit": [],
    "planning": [
      "data/ai/modelswatch/fetch_priorities.json"
    ]
  },
  "notes": {
    "legacy_items": 7,
    "hotlists": {
      "models": {
        "categories": 8,
        "items": 9
      },
      "projects": {
        "categories": 3,
        "items": 3
      }
    }
  }
}
