{
  "schema_version": 1,
  "pipeline_version": "v6",
  "date": "2026-06-08",
  "generated_at": "2026-06-08T04:03:33.981Z",
  "run_id": "qualify-publish-2026-06-08-20260608040333.-bd3b67db",
  "sources": {
    "github": {
      "published": 3,
      "qualified": 3,
      "passonce": 0,
      "coverage_pct": 1,
      "duplicates": 0,
      "inputs": {
        "passonce": 0,
        "qualified": 7
      }
    },
    "huggingface": {
      "published": 1,
      "qualified": 1,
      "passonce": 0,
      "coverage_pct": 1,
      "duplicates": 0,
      "inputs": {
        "passonce": 4,
        "qualified": 2
      }
    }
  },
  "totals": {
    "items": 13,
    "coverage_pct": 1,
    "sources": [
      "github",
      "huggingface"
    ]
  },
  "classification": {
    "tasks": {
      "taxonomy_total": 91,
      "buckets_covered": 10,
      "coverage_pct": 0.1099,
      "assignments": 19,
      "items_with_assignments": 9,
      "items_without_assignments": 4
    },
    "categories": {
      "taxonomy_total": 9,
      "buckets_covered": 7,
      "coverage_pct": 0.7778,
      "assignments": 20,
      "items_with_assignments": 7,
      "items_without_assignments": 0
    }
  },
  "checksums": {
    "data/ai/modelswatch/daily/2026-06-08.github.json": "sha256:a4bebf06f1440b2986ac5ae365d8ef4a7d168d8e64c8304f22add41bfecd1c88",
    "data/ai/modelswatch/daily_github.json": "sha256:a4bebf06f1440b2986ac5ae365d8ef4a7d168d8e64c8304f22add41bfecd1c88",
    "data/ai/modelswatch/daily/2026-06-08.huggingface.json": "sha256:83410877568ce8197cd76ef1efe1a7cd5c9b6ff540d9e5876afc76cdacc04eda",
    "data/ai/modelswatch/daily_hf.json": "sha256:83410877568ce8197cd76ef1efe1a7cd5c9b6ff540d9e5876afc76cdacc04eda",
    "data/ai/modelswatch/index/models_by_task.json": "sha256:4a4c4d3dd896cefd16277a5024badc91d80b237b65c4ebae76d74d10f03d6847",
    "data/ai/modelswatch/index/projects_by_category.json": "sha256:2b3ca6ab7b5588af0dd2b3dc97436bec002827d71d6f0626c11ef8cee9c5dd86",
    "data/ai/modelswatch/fetch_priorities.json": "sha256:baa7e0df345f0f228c19e530add11b4b5cdc67d74ed3429dad6272952ed23174",
    "data/ai/modelswatch/models_hotlist.json": "sha256:bb5624b85c50033300da039cf9538f07f6ed06eef580d7281c3a1481f267449b",
    "data/ai/modelswatch/projects_hotlist.json": "sha256:61369d6baf1d59335632b63b900c33cf9c88b07c04a5161ecb0ac734dc3b9772",
    "data/ai/modelswatch/daily/2026-06-08.legacy.json": "sha256:999c32b242fa4c31f54b61e9db84932da1512e161b9ec1cac2a7e9ce6ce31376",
    "data/ai/modelswatch/daily_legacy.json": "sha256:999c32b242fa4c31f54b61e9db84932da1512e161b9ec1cac2a7e9ce6ce31376",
    "data/ai/modelswatch/daily/dates.json": "sha256:ba7c2551cfb1df6cd7d30c0b78b9d59fa56680bf99af522a58a79598938f101a"
  },
  "artifacts": {
    "daily": [
      "data/ai/modelswatch/daily/2026-06-08.github.json",
      "data/ai/modelswatch/daily/2026-06-08.huggingface.json"
    ],
    "daily_aliases": [
      "data/ai/modelswatch/daily_github.json",
      "data/ai/modelswatch/daily_hf.json"
    ],
    "indexes": [
      "data/ai/modelswatch/index/models_by_task.json",
      "data/ai/modelswatch/index/projects_by_category.json"
    ],
    "hotlists": [
      "data/ai/modelswatch/models_hotlist.json",
      "data/ai/modelswatch/projects_hotlist.json"
    ],
    "legacy": [
      "data/ai/modelswatch/daily/2026-06-08.legacy.json"
    ],
    "legacy_aliases": [
      "data/ai/modelswatch/daily_legacy.json"
    ],
    "dates": [
      "data/ai/modelswatch/daily/dates.json"
    ],
    "state": [],
    "audit": [],
    "planning": [
      "data/ai/modelswatch/fetch_priorities.json"
    ]
  },
  "notes": {
    "legacy_items": 13,
    "hotlists": {
      "models": {
        "categories": 8,
        "items": 11
      },
      "projects": {
        "categories": 7,
        "items": 20
      }
    }
  }
}
