{
  "schema_version": 1,
  "pipeline_version": "v6",
  "date": "2025-11-25",
  "generated_at": "2025-11-25T03:10:10.915Z",
  "run_id": "qualify-publish-2025-11-25-20251125031010.-b1ef61e9",
  "sources": {
    "github": {
      "published": 0,
      "qualified": 0,
      "passonce": 0,
      "coverage_pct": 0,
      "duplicates": 0,
      "inputs": {
        "passonce": 0,
        "qualified": 0
      }
    },
    "huggingface": {
      "published": 0,
      "qualified": 0,
      "passonce": 0,
      "coverage_pct": 0,
      "duplicates": 0,
      "inputs": {
        "passonce": 5,
        "qualified": 0
      }
    }
  },
  "totals": {
    "items": 5,
    "coverage_pct": 0,
    "sources": [
      "github",
      "huggingface"
    ]
  },
  "classification": {
    "tasks": {
      "taxonomy_total": 91,
      "buckets_covered": 5,
      "coverage_pct": 0.0549,
      "assignments": 6,
      "items_with_assignments": 3,
      "items_without_assignments": 2
    },
    "categories": {
      "taxonomy_total": 9,
      "buckets_covered": 0,
      "coverage_pct": 0,
      "assignments": 0,
      "items_with_assignments": 0,
      "items_without_assignments": 0
    }
  },
  "checksums": {
    "data/ai/modelswatch/daily/2025-11-25.github.json": "sha256:3e818216fad23ad00f342fe352bc38f284e4a14aa0d4fd2c2c0f7aacaabf0d80",
    "data/ai/modelswatch/daily_github.json": "sha256:3e818216fad23ad00f342fe352bc38f284e4a14aa0d4fd2c2c0f7aacaabf0d80",
    "data/ai/modelswatch/daily/2025-11-25.huggingface.json": "sha256:bd4fd9bf048921ddd6b454d1a9ff6e4d80b8e72fa96efdd4ab52f201495648af",
    "data/ai/modelswatch/daily_hf.json": "sha256:bd4fd9bf048921ddd6b454d1a9ff6e4d80b8e72fa96efdd4ab52f201495648af",
    "data/ai/modelswatch/index/models_by_task.json": "sha256:d396761052d9421a451fbc062cd7b1a18ac90ee5279507f5635c8c7f211cd97e",
    "data/ai/modelswatch/fetch_priorities.json": "sha256:b4075ad57f33ad710e83fa585abeb4dc61506aa546613e99b6af2c0e403cf6f4",
    "data/ai/modelswatch/models_hotlist.json": "sha256:71a94f598afa3da22236fcb869c368b6df6760b48c81fc26029f2137359ee889",
    "data/ai/modelswatch/projects_hotlist.json": "sha256:3377db9bee8e3452adc546fe5e1ea6680a4c33cf346975da7a134d0325c1a32d",
    "data/ai/modelswatch/daily/2025-11-25.legacy.json": "sha256:390724403d5b56e27398c27322f26b817772dda299dfd21f88025416693cae24",
    "data/ai/modelswatch/daily_legacy.json": "sha256:390724403d5b56e27398c27322f26b817772dda299dfd21f88025416693cae24",
    "data/ai/modelswatch/daily/dates.json": "sha256:ba3762f01bdfe9aa43aa1fccf74da4e11658c6ce75f05a38184b4131ad7aa2f5"
  },
  "artifacts": {
    "daily": [
      "data/ai/modelswatch/daily/2025-11-25.github.json",
      "data/ai/modelswatch/daily/2025-11-25.huggingface.json"
    ],
    "daily_aliases": [
      "data/ai/modelswatch/daily_github.json",
      "data/ai/modelswatch/daily_hf.json"
    ],
    "indexes": [
      "data/ai/modelswatch/index/models_by_task.json"
    ],
    "hotlists": [
      "data/ai/modelswatch/models_hotlist.json",
      "data/ai/modelswatch/projects_hotlist.json"
    ],
    "legacy": [
      "data/ai/modelswatch/daily/2025-11-25.legacy.json"
    ],
    "legacy_aliases": [
      "data/ai/modelswatch/daily_legacy.json"
    ],
    "dates": [
      "data/ai/modelswatch/daily/dates.json"
    ],
    "state": [],
    "audit": [],
    "planning": [
      "data/ai/modelswatch/fetch_priorities.json"
    ]
  },
  "notes": {
    "legacy_items": 5,
    "hotlists": {
      "models": {
        "categories": 5,
        "items": 6
      },
      "projects": {
        "categories": 0,
        "items": 0
      }
    }
  }
}
