{
  "schema_version": 1,
  "pipeline_version": "v6",
  "date": "2025-10-11",
  "generated_at": "2025-10-11T10:05:22.174Z",
  "run_id": "qualify-publish-2025-10-11-20251011100522.-fba931be",
  "sources": {
    "github": {
      "published": 0,
      "qualified": 0,
      "passonce": 0,
      "coverage_pct": 0,
      "duplicates": 0,
      "inputs": {
        "passonce": 0,
        "qualified": 0
      }
    },
    "huggingface": {
      "published": 3,
      "qualified": 2,
      "passonce": 1,
      "coverage_pct": 0.6667,
      "duplicates": 0,
      "inputs": {
        "passonce": 1,
        "qualified": 2
      }
    }
  },
  "totals": {
    "items": 3,
    "coverage_pct": 0.6667,
    "sources": [
      "github",
      "huggingface"
    ]
  },
  "classification": {
    "tasks": {
      "taxonomy_total": 91,
      "buckets_covered": 3,
      "coverage_pct": 0.033,
      "assignments": 3,
      "items_with_assignments": 2,
      "items_without_assignments": 1
    },
    "categories": {
      "taxonomy_total": 9,
      "buckets_covered": 0,
      "coverage_pct": 0,
      "assignments": 0,
      "items_with_assignments": 0,
      "items_without_assignments": 0
    }
  },
  "checksums": {
    "data/ai/modelswatch/daily/2025-10-11.github.json": "sha256:72fbde0b4e0eedaf8f079839c16a0325f82c845877227115296fdc4a38ae23ff",
    "data/ai/modelswatch/daily_github.json": "sha256:72fbde0b4e0eedaf8f079839c16a0325f82c845877227115296fdc4a38ae23ff",
    "data/ai/modelswatch/daily/2025-10-11.huggingface.json": "sha256:3e34bac2e9509cd5f986528620f8fcfb7640ecb466821cc28b4f67ba16ad1a7c",
    "data/ai/modelswatch/daily_hf.json": "sha256:3e34bac2e9509cd5f986528620f8fcfb7640ecb466821cc28b4f67ba16ad1a7c",
    "data/ai/modelswatch/index/models_by_task.json": "sha256:622f5a43a796aeba145541242c5baa4d341219d7461a5ad1c1b83e424d7474a2",
    "data/ai/modelswatch/fetch_priorities.json": "sha256:adb7601e153d89f719b118e28fb36ceb6c5ef0b64bd917358b9e028c4d40418e",
    "data/ai/modelswatch/models_hotlist.json": "sha256:cbd3db6c97a6b78a7b485dc5884d97d95a075cdb01d38cad279c6b7b8c565f23",
    "data/ai/modelswatch/projects_hotlist.json": "sha256:ba943b968186314a1f87af0c63eaf2325858ca3195a6372a8e05da44cbe3416e",
    "data/ai/modelswatch/daily/2025-10-11.legacy.json": "sha256:ad07cb0af16adad48cedaf8a7fcc7eb4c6182172c67c9662f446fea5f37b95d4",
    "data/ai/modelswatch/daily_legacy.json": "sha256:ad07cb0af16adad48cedaf8a7fcc7eb4c6182172c67c9662f446fea5f37b95d4",
    "data/ai/modelswatch/daily/dates.json": "sha256:62ab826791e214237c73dad0c7e1ee3a35d7aecbfce95d2d224481a35239b283"
  },
  "artifacts": {
    "daily": [
      "data/ai/modelswatch/daily/2025-10-11.github.json",
      "data/ai/modelswatch/daily/2025-10-11.huggingface.json"
    ],
    "daily_aliases": [
      "data/ai/modelswatch/daily_github.json",
      "data/ai/modelswatch/daily_hf.json"
    ],
    "indexes": [
      "data/ai/modelswatch/index/models_by_task.json"
    ],
    "hotlists": [
      "data/ai/modelswatch/models_hotlist.json",
      "data/ai/modelswatch/projects_hotlist.json"
    ],
    "legacy": [
      "data/ai/modelswatch/daily/2025-10-11.legacy.json"
    ],
    "legacy_aliases": [
      "data/ai/modelswatch/daily_legacy.json"
    ],
    "dates": [
      "data/ai/modelswatch/daily/dates.json"
    ],
    "state": [],
    "audit": [],
    "planning": [
      "data/ai/modelswatch/fetch_priorities.json"
    ]
  },
  "notes": {
    "legacy_items": 3,
    "hotlists": {
      "models": {
        "categories": 3,
        "items": 3
      },
      "projects": {
        "categories": 0,
        "items": 0
      }
    }
  }
}
