{
  "schema_version": 1,
  "pipeline_version": "v6",
  "date": "2026-02-08",
  "generated_at": "2026-02-08T03:47:15.024Z",
  "run_id": "qualify-publish-2026-02-08-20260208034715.-8d4e5038",
  "sources": {
    "github": {
      "published": 7,
      "qualified": 7,
      "passonce": 0,
      "coverage_pct": 1,
      "duplicates": 0,
      "inputs": {
        "passonce": 0,
        "qualified": 8
      }
    },
    "huggingface": {
      "published": 0,
      "qualified": 0,
      "passonce": 0,
      "coverage_pct": 0,
      "duplicates": 0,
      "inputs": {
        "passonce": 5,
        "qualified": 0
      }
    }
  },
  "totals": {
    "items": 13,
    "coverage_pct": 1,
    "sources": [
      "github",
      "huggingface"
    ]
  },
  "classification": {
    "tasks": {
      "taxonomy_total": 91,
      "buckets_covered": 9,
      "coverage_pct": 0.0989,
      "assignments": 13,
      "items_with_assignments": 8,
      "items_without_assignments": 5
    },
    "categories": {
      "taxonomy_total": 9,
      "buckets_covered": 8,
      "coverage_pct": 0.8889,
      "assignments": 21,
      "items_with_assignments": 8,
      "items_without_assignments": 0
    }
  },
  "checksums": {
    "data/ai/modelswatch/daily/2026-02-08.github.json": "sha256:ce5484310d0f1717eea201d90ebb55b8c2dbfa78df3f5950bd3e041b8c31fafe",
    "data/ai/modelswatch/daily_github.json": "sha256:ce5484310d0f1717eea201d90ebb55b8c2dbfa78df3f5950bd3e041b8c31fafe",
    "data/ai/modelswatch/daily/2026-02-08.huggingface.json": "sha256:136e9dbf468348bca5d2c711391b2a53de6e7a8f26a5d8c4dc812916cfa4ddbf",
    "data/ai/modelswatch/daily_hf.json": "sha256:136e9dbf468348bca5d2c711391b2a53de6e7a8f26a5d8c4dc812916cfa4ddbf",
    "data/ai/modelswatch/index/models_by_task.json": "sha256:cdae1943671c8d9d1836a8f54c5d303eb83493ec781f20cd7313860c02754737",
    "data/ai/modelswatch/index/projects_by_category.json": "sha256:77c808dc7c875ded934d22f84ae31d7471d19e5e7315a68b18bd9e6ae61f2d29",
    "data/ai/modelswatch/fetch_priorities.json": "sha256:d836102c9266b5e981d804c9d48d797c7fc1696adf8d38e732b1c77454a29e56",
    "data/ai/modelswatch/models_hotlist.json": "sha256:269a4d58c8091b087f0f84ba5f487bc0f4d7535370e65559809dcd6c8944baef",
    "data/ai/modelswatch/projects_hotlist.json": "sha256:b1f7d1194bfee66596268d3aceb5605fb7d09263949fc2e0e4e82868da519c1a",
    "data/ai/modelswatch/daily/2026-02-08.legacy.json": "sha256:b92cd7c664b11f56dd898b54daaacac457da4747f02abbd4dca273cdf7aae8b4",
    "data/ai/modelswatch/daily_legacy.json": "sha256:b92cd7c664b11f56dd898b54daaacac457da4747f02abbd4dca273cdf7aae8b4",
    "data/ai/modelswatch/daily/dates.json": "sha256:c4854bbe0ec4243cf987736d977e266d158ae98ac074cfeb05b3af4552a76e4a"
  },
  "artifacts": {
    "daily": [
      "data/ai/modelswatch/daily/2026-02-08.github.json",
      "data/ai/modelswatch/daily/2026-02-08.huggingface.json"
    ],
    "daily_aliases": [
      "data/ai/modelswatch/daily_github.json",
      "data/ai/modelswatch/daily_hf.json"
    ],
    "indexes": [
      "data/ai/modelswatch/index/models_by_task.json",
      "data/ai/modelswatch/index/projects_by_category.json"
    ],
    "hotlists": [
      "data/ai/modelswatch/models_hotlist.json",
      "data/ai/modelswatch/projects_hotlist.json"
    ],
    "legacy": [
      "data/ai/modelswatch/daily/2026-02-08.legacy.json"
    ],
    "legacy_aliases": [
      "data/ai/modelswatch/daily_legacy.json"
    ],
    "dates": [
      "data/ai/modelswatch/daily/dates.json"
    ],
    "state": [],
    "audit": [],
    "planning": [
      "data/ai/modelswatch/fetch_priorities.json"
    ]
  },
  "notes": {
    "legacy_items": 13,
    "hotlists": {
      "models": {
        "categories": 5,
        "items": 6
      },
      "projects": {
        "categories": 8,
        "items": 21
      }
    }
  }
}
