{
  "schema_version": 1,
  "pipeline_version": "v6",
  "date": "2026-06-05",
  "generated_at": "2026-06-05T04:02:45.790Z",
  "run_id": "qualify-publish-2026-06-05-20260605040245.-1fbea274",
  "sources": {
    "github": {
      "published": 3,
      "qualified": 3,
      "passonce": 0,
      "coverage_pct": 1,
      "duplicates": 0,
      "inputs": {
        "passonce": 0,
        "qualified": 6
      }
    },
    "huggingface": {
      "published": 1,
      "qualified": 1,
      "passonce": 0,
      "coverage_pct": 1,
      "duplicates": 0,
      "inputs": {
        "passonce": 4,
        "qualified": 2
      }
    }
  },
  "totals": {
    "items": 12,
    "coverage_pct": 1,
    "sources": [
      "github",
      "huggingface"
    ]
  },
  "classification": {
    "tasks": {
      "taxonomy_total": 91,
      "buckets_covered": 7,
      "coverage_pct": 0.0769,
      "assignments": 15,
      "items_with_assignments": 7,
      "items_without_assignments": 5
    },
    "categories": {
      "taxonomy_total": 9,
      "buckets_covered": 6,
      "coverage_pct": 0.6667,
      "assignments": 18,
      "items_with_assignments": 6,
      "items_without_assignments": 0
    }
  },
  "checksums": {
    "data/ai/modelswatch/daily/2026-06-05.github.json": "sha256:c883fc35decd90cc9957411499d80593938044265a34b52e16e4e041fdef7fcc",
    "data/ai/modelswatch/daily_github.json": "sha256:c883fc35decd90cc9957411499d80593938044265a34b52e16e4e041fdef7fcc",
    "data/ai/modelswatch/daily/2026-06-05.huggingface.json": "sha256:9751a3901bf34cc5f9eec8d4b918ec874be208d1bd9423867cdb57cf5bebec2c",
    "data/ai/modelswatch/daily_hf.json": "sha256:9751a3901bf34cc5f9eec8d4b918ec874be208d1bd9423867cdb57cf5bebec2c",
    "data/ai/modelswatch/index/models_by_task.json": "sha256:2848f18ff6898624d287982a3ec5b8a27cc22e3017aca60266653c6d9a4bfbee",
    "data/ai/modelswatch/index/projects_by_category.json": "sha256:9a4eb512605e9527829bdc38fa6a49217c3bc83baae1b36412b1d5ab783e44f9",
    "data/ai/modelswatch/fetch_priorities.json": "sha256:38e69775f90df406e9b7fa7f9b14a9ff2a51ad5ac94377bdc672a00446eebba3",
    "data/ai/modelswatch/models_hotlist.json": "sha256:68df813d98e1275bac097278e9d34e498bfd136e287bedacd21ce6ad17a31fbe",
    "data/ai/modelswatch/projects_hotlist.json": "sha256:e8d65d3f2cbc1aee561e0e42d9fd3b1b15835035a390be4848ff736aa795215e",
    "data/ai/modelswatch/daily/2026-06-05.legacy.json": "sha256:0f1f7c7ad0387be37f378b8160a6e4beca1cd2650ad3334871c7b92526810c9c",
    "data/ai/modelswatch/daily_legacy.json": "sha256:0f1f7c7ad0387be37f378b8160a6e4beca1cd2650ad3334871c7b92526810c9c",
    "data/ai/modelswatch/daily/dates.json": "sha256:582286959bf65481d43bac83d6c83bb8552a6b57d4119dc5915d5d6dc1896d2a"
  },
  "artifacts": {
    "daily": [
      "data/ai/modelswatch/daily/2026-06-05.github.json",
      "data/ai/modelswatch/daily/2026-06-05.huggingface.json"
    ],
    "daily_aliases": [
      "data/ai/modelswatch/daily_github.json",
      "data/ai/modelswatch/daily_hf.json"
    ],
    "indexes": [
      "data/ai/modelswatch/index/models_by_task.json",
      "data/ai/modelswatch/index/projects_by_category.json"
    ],
    "hotlists": [
      "data/ai/modelswatch/models_hotlist.json",
      "data/ai/modelswatch/projects_hotlist.json"
    ],
    "legacy": [
      "data/ai/modelswatch/daily/2026-06-05.legacy.json"
    ],
    "legacy_aliases": [
      "data/ai/modelswatch/daily_legacy.json"
    ],
    "dates": [
      "data/ai/modelswatch/daily/dates.json"
    ],
    "state": [],
    "audit": [],
    "planning": [
      "data/ai/modelswatch/fetch_priorities.json"
    ]
  },
  "notes": {
    "legacy_items": 12,
    "hotlists": {
      "models": {
        "categories": 5,
        "items": 10
      },
      "projects": {
        "categories": 6,
        "items": 18
      }
    }
  }
}
