{
  "schema_version": 1,
  "pipeline_version": "v6",
  "date": "2026-06-14",
  "generated_at": "2026-06-14T04:03:46.296Z",
  "run_id": "qualify-publish-2026-06-14-20260614040346.-02c0093a",
  "sources": {
    "github": {
      "published": 3,
      "qualified": 3,
      "passonce": 0,
      "coverage_pct": 1,
      "duplicates": 0,
      "inputs": {
        "passonce": 0,
        "qualified": 4
      }
    },
    "huggingface": {
      "published": 0,
      "qualified": 0,
      "passonce": 0,
      "coverage_pct": 0,
      "duplicates": 0,
      "inputs": {
        "passonce": 4,
        "qualified": 1
      }
    }
  },
  "totals": {
    "items": 9,
    "coverage_pct": 1,
    "sources": [
      "github",
      "huggingface"
    ]
  },
  "classification": {
    "tasks": {
      "taxonomy_total": 91,
      "buckets_covered": 5,
      "coverage_pct": 0.0549,
      "assignments": 10,
      "items_with_assignments": 5,
      "items_without_assignments": 4
    },
    "categories": {
      "taxonomy_total": 9,
      "buckets_covered": 5,
      "coverage_pct": 0.5556,
      "assignments": 9,
      "items_with_assignments": 4,
      "items_without_assignments": 0
    }
  },
  "checksums": {
    "data/ai/modelswatch/daily/2026-06-14.github.json": "sha256:f3aff96879433cbaabd36a9aafc155d5874a5ef6b8ceed4bea18ca11d5fe2685",
    "data/ai/modelswatch/daily_github.json": "sha256:f3aff96879433cbaabd36a9aafc155d5874a5ef6b8ceed4bea18ca11d5fe2685",
    "data/ai/modelswatch/daily/2026-06-14.huggingface.json": "sha256:5cad461bb0eedbb73b7e5bb1a6edc2a621d3eb87cdb9fe2ae7a7ff17242967ab",
    "data/ai/modelswatch/daily_hf.json": "sha256:5cad461bb0eedbb73b7e5bb1a6edc2a621d3eb87cdb9fe2ae7a7ff17242967ab",
    "data/ai/modelswatch/index/models_by_task.json": "sha256:b68705d87e5b7209d92d3b8b6cfbb2e2a53b9ab80a4f449ab0e632b86d0f93a6",
    "data/ai/modelswatch/index/projects_by_category.json": "sha256:ede648e9c0105c0cf4c60bde4370f28375b2ed71424b8501c9de5b64a9dc6415",
    "data/ai/modelswatch/fetch_priorities.json": "sha256:3e97d40a2d55d4b1551db503e04bfe2996a6b61b0ad6af0c336578eb769ae331",
    "data/ai/modelswatch/models_hotlist.json": "sha256:899eb7cf62fdbfd270c338696f9ba643b84cdab06390efe066878a4ab255e1ee",
    "data/ai/modelswatch/projects_hotlist.json": "sha256:36997d841adc7d2106bb94569acda1edd54891b7b90d9d8c1ba5a50a68a6358a",
    "data/ai/modelswatch/daily/2026-06-14.legacy.json": "sha256:7b61a1cc9e8916853701bb9c46bf1398278c4f09a6d1b6b1a1df554c142e42c4",
    "data/ai/modelswatch/daily_legacy.json": "sha256:7b61a1cc9e8916853701bb9c46bf1398278c4f09a6d1b6b1a1df554c142e42c4",
    "data/ai/modelswatch/daily/dates.json": "sha256:630ead0e13898b1cdf258379de3771a1ab4144bd6aba9ede0b3c36be4c4f7da8"
  },
  "artifacts": {
    "daily": [
      "data/ai/modelswatch/daily/2026-06-14.github.json",
      "data/ai/modelswatch/daily/2026-06-14.huggingface.json"
    ],
    "daily_aliases": [
      "data/ai/modelswatch/daily_github.json",
      "data/ai/modelswatch/daily_hf.json"
    ],
    "indexes": [
      "data/ai/modelswatch/index/models_by_task.json",
      "data/ai/modelswatch/index/projects_by_category.json"
    ],
    "hotlists": [
      "data/ai/modelswatch/models_hotlist.json",
      "data/ai/modelswatch/projects_hotlist.json"
    ],
    "legacy": [
      "data/ai/modelswatch/daily/2026-06-14.legacy.json"
    ],
    "legacy_aliases": [
      "data/ai/modelswatch/daily_legacy.json"
    ],
    "dates": [
      "data/ai/modelswatch/daily/dates.json"
    ],
    "state": [],
    "audit": [],
    "planning": [
      "data/ai/modelswatch/fetch_priorities.json"
    ]
  },
  "notes": {
    "legacy_items": 9,
    "hotlists": {
      "models": {
        "categories": 5,
        "items": 8
      },
      "projects": {
        "categories": 5,
        "items": 9
      }
    }
  }
}
