{
  "schema_version": 1,
  "pipeline_version": "v6",
  "date": "2026-05-09",
  "generated_at": "2026-05-09T04:00:14.125Z",
  "run_id": "qualify-publish-2026-05-09-20260509040014.-d383a9cf",
  "sources": {
    "github": {
      "published": 4,
      "qualified": 4,
      "passonce": 0,
      "coverage_pct": 1,
      "duplicates": 0,
      "inputs": {
        "passonce": 0,
        "qualified": 6
      }
    },
    "huggingface": {
      "published": 1,
      "qualified": 1,
      "passonce": 0,
      "coverage_pct": 1,
      "duplicates": 0,
      "inputs": {
        "passonce": 4,
        "qualified": 2
      }
    }
  },
  "totals": {
    "items": 12,
    "coverage_pct": 1,
    "sources": [
      "github",
      "huggingface"
    ]
  },
  "classification": {
    "tasks": {
      "taxonomy_total": 91,
      "buckets_covered": 10,
      "coverage_pct": 0.1099,
      "assignments": 10,
      "items_with_assignments": 5,
      "items_without_assignments": 7
    },
    "categories": {
      "taxonomy_total": 9,
      "buckets_covered": 6,
      "coverage_pct": 0.6667,
      "assignments": 16,
      "items_with_assignments": 6,
      "items_without_assignments": 0
    }
  },
  "checksums": {
    "data/ai/modelswatch/daily/2026-05-09.github.json": "sha256:9fc127b5d5ef2bea4bf86cb370c78e95798e867c3005ae19ecf64f50a6e07a1b",
    "data/ai/modelswatch/daily_github.json": "sha256:9fc127b5d5ef2bea4bf86cb370c78e95798e867c3005ae19ecf64f50a6e07a1b",
    "data/ai/modelswatch/daily/2026-05-09.huggingface.json": "sha256:bc8e64898685efe8708edde1f8635cdbf95e3ed5daf6941c506e7378e2952483",
    "data/ai/modelswatch/daily_hf.json": "sha256:bc8e64898685efe8708edde1f8635cdbf95e3ed5daf6941c506e7378e2952483",
    "data/ai/modelswatch/index/models_by_task.json": "sha256:c95ef41d11490ec51f4ccfef1c5b7bc67afb13a2c9f58172c86b220d620d172a",
    "data/ai/modelswatch/index/projects_by_category.json": "sha256:0f60b59e058a5d48b6b53298f422624a3f69500e090c8bd37df45396e54accda",
    "data/ai/modelswatch/fetch_priorities.json": "sha256:f857812bec8f4d8d23fa8264cb60fa4f0a7abb4ca2797b5fd882998501bf9ba3",
    "data/ai/modelswatch/models_hotlist.json": "sha256:e8356e9eb82f5c8d5ca2507521a36313bf55ac895d6e977d02a333e005de65c3",
    "data/ai/modelswatch/projects_hotlist.json": "sha256:cc52f72f02a9c276a4565e8851da39488fe2cba3e21b30b69da20362d62b4409",
    "data/ai/modelswatch/daily/2026-05-09.legacy.json": "sha256:57749086b29f73993a9dfd5aaeb0aa0006e7cb2fb9ffb69c2ef488a1e899d6b4",
    "data/ai/modelswatch/daily_legacy.json": "sha256:57749086b29f73993a9dfd5aaeb0aa0006e7cb2fb9ffb69c2ef488a1e899d6b4",
    "data/ai/modelswatch/daily/dates.json": "sha256:47816f7caf00b35834701e7d58733153e0c4bd8a3cccf4a0426e3e9dfbcdd851"
  },
  "artifacts": {
    "daily": [
      "data/ai/modelswatch/daily/2026-05-09.github.json",
      "data/ai/modelswatch/daily/2026-05-09.huggingface.json"
    ],
    "daily_aliases": [
      "data/ai/modelswatch/daily_github.json",
      "data/ai/modelswatch/daily_hf.json"
    ],
    "indexes": [
      "data/ai/modelswatch/index/models_by_task.json",
      "data/ai/modelswatch/index/projects_by_category.json"
    ],
    "hotlists": [
      "data/ai/modelswatch/models_hotlist.json",
      "data/ai/modelswatch/projects_hotlist.json"
    ],
    "legacy": [
      "data/ai/modelswatch/daily/2026-05-09.legacy.json"
    ],
    "legacy_aliases": [
      "data/ai/modelswatch/daily_legacy.json"
    ],
    "dates": [
      "data/ai/modelswatch/daily/dates.json"
    ],
    "state": [],
    "audit": [],
    "planning": [
      "data/ai/modelswatch/fetch_priorities.json"
    ]
  },
  "notes": {
    "legacy_items": 12,
    "hotlists": {
      "models": {
        "categories": 9,
        "items": 9
      },
      "projects": {
        "categories": 6,
        "items": 16
      }
    }
  }
}
